id,Nombre,Tipo,Horario,Ciudad,Tiempo,Esfuerzo,Costo,Descripción,Detalle,NotaIA,LATLON,Image
th052,Koh Tao (Buceo/Snorkel),Visita,Da Igual,Isla,2-3 días,Medio,Variable,El lugar más barato del mundo para bucear.,"Ambiente joven, calas pequeñas y aguas mansas. Ideal para sacar el certificado PADI.",Shark Bay es excelente para ver tiburones de punta negra (inofensivos).,"10.0956, 99.8404",https://scubafinders.com/blog/wp-content/uploads/2025/02/buceo-en-koh-tao.webp
th053,Lalitta Café,Comida,Da Igual,Chiang Rai,1.5h,Bajo,60 THB,Café inmersivo que parece un bosque encantado.,"Famoso por su niebla artificial constante, cascadas y flores exóticas. Es un restaurante completo.",Se paga entrada pero el valor se descuenta de lo que consumas dentro.,"19.9234, 99.8142",https://media-cdn.tripadvisor.com/media/photo-m/1280/26/8a/94/08/caption.jpg
th054,Lard Yai Market,Mercado,Da Igual,Phuket,2h,Bajo,Variable,Mercado nocturno de los domingos en el casco viejo.,Se realiza solo el domingo en Thalang Road. Comida local y shows callejeros.,Es el mejor momento para ver el casco histórico iluminado y con vida.,"7.8848, 98.3891",https://thumbs.dreamstime.com/b/phuket-thailand-may-lard-yai-walking-street-night-market-every-sunday-famous-great-shopping-local-food-performance-arts-cafes-155400844.jpg
th130,Lion House Phuket,Experiencia,Da Igual,Phuket,1-2h,Bajo,Desde 1.000 THB (interacción; varía por paquete),Café junto a un lago con opción de ver/interactuar con cachorro de león (polémico).,"Dirección: 531/20 Phuket Rd, Talat Yai, Mueang Phuket, Phuket 83000. Horario aprox.: 10:00–20:00. Actividad: café/brunch + área de fotos/interacción (paquetes y tiempos varían). Tip: reservar/consultar condiciones y reglas (no flash, movimientos suaves).",Las experiencias de 'cachorros para fotos' suelen estar asociadas a problemas de bienestar y comercio de fauna. Si vas evaluá críticamente condiciones (espacio manejo descanso del animal) y evitá prácticas invasivas.,"7.8755234, 98.3981891",https://dynamic-media-cdn.tripadvisor.com/media/photo-o/31/a0/65/19/einzigartiges-ambiente.jpg
th055,Little Den Cafe,Visita,Mañana,Bangkok,1.5h,Bajo,400 THB,"Café temático con suricatas, zorros fennec y capibaras.",Tienes que ponerte pantuflas y lavarte las manos al entrar. Los animales están vacunados y cuidados.,Debes reservar por adelantado ya que el cupo es muy limitado.,"13.7300, 100.5800",https://cdn.corner.inc/place-photo/AWYs27z5ZZAAGJ8TAaAYckDfdANZggckWr6WPrpCVxNJgXD55H65y_wHAcoAayvP6Fv6gUCiPMxjC6RJVmk2iGWIpzh5wRrr7sAo9NbbgETg2ZtIKbAVxPD7qPln_cB1njV3eQODkOej2NZDlz7kOf-G6HFOR8CCTFCAcdDBlqAVWRYf3KNA.jpeg
th056,Lumphini Park,Visita,Mañana/Tarde,Bangkok,1-2 hs,Bajo,Gratis,"Parque urbano icónico: caminata, lago y chance de ver varanos (monitor lizards).",Ideal a la mañana temprano o al atardecer. Entrada gratuita; suele abrir 04:30 y cerrar 21:00–22:00 según temporada.,Buen “reset” entre templos/compras; llevar repelente si vas al atardecer.,"13.73056, 100.54167",https://dynamic-media-cdn.tripadvisor.com/media/photo-o/10/b8/3b/d3/lumpini-park-4.jpg
th057,Mae Kampong Village,Visita,Da Igual,Cerca CM,4h,Medio,Gratis,Aldea de montaña auténtica y nublada.,"Famosa por su café de altura, cascadas y casas de madera tradicionales.",Aire puro y temperatura mucho más fresca que en la ciudad.,"18.8653, 99.3495",https://dynamic-media-cdn.tripadvisor.com/media/photo-o/16/1b/e2/ef/photo0jpg.jpg
th131,Maeklong Railway Market (Talad Rom Hoop),Mercado,Mañana,Bangkok (excursión),2h,Bajo,-,Mercado sobre las vías: ver cómo pliegan los puestos cuando pasa el tren.,"Ubicación: junto a Maeklong Railway Station, Samut Songkhram. Ideal ir con horario de paso del tren (pasa varias veces al día). Tip: pararte detrás de las líneas rojas y dejar pasar el tren; buen combo con Amphawa (tarde) el mismo día.",Actividad fotogénica pero concurrida: cuidar pertenencias y priorizar seguridad cuando pasa el tren.,"13.4076, 100.0005",https://dynamic-media-cdn.tripadvisor.com/media/photo-o/30/4e/4f/4e/caption.jpg
th058,MahaNakhon SkyWalk,Visita,Mañana,Bangkok,2h,Bajo,1050 THB+,Mirador con piso de cristal a 314m.,Piso 78. No cámaras en el vidrio. Ir antes de las 16h es más barato. Compra en apps como GetYourGuide o Klook para conseguir combos con descuento.,"Si almuerzas en el restaurante Ojo, el acceso suele estar incluido o bonificado.","13.7235, 100.5284",https://media-cdn.tripadvisor.com/media/attractions-splice-spp-674x446/12/1d/df/0e.jpg
th059,MBK Center,Compras,Da Igual,Bangkok,3h,Medio,Variable,El paraíso de las réplicas y electrónica.,"8 plantas. Busca las ""secret rooms"" para réplicas de lujo (bolsos/relojes) de alta calidad. Regatear es obligatorio.","Abre a las 10am. Es el lugar ideal para comprar ropa ""fake"" pero bien hecha.","13.7444, 100.5299",https://dynamic-media-cdn.tripadvisor.com/media/photo-o/2b/74/a1/0b/mbk-center.jpg
th060,Monos Carteristas,Consejo,Mañana,Varias (Playas/Templos),-,Bajo,$0,Precaución con los monos salvajes en zonas turísticas.,"Los monos en lugares como Phi Phi o Lopburi roban comida, móviles y bolsos si te descuidas.",Nunca intentes recuperar algo a la fuerza si el mono se pone agresivo; busca ayuda de un local.,"7.7407, 98.7784",https://www.turismodebolsillo.com.ar/wp-content/uploads/2025/08/hq720.jpg
th061,Mujeres Jirafa (Karen),Cultura,Tarde,Chiang Rai,1.5h,Bajo,500 THB,Visita a la aldea de la etnia Long Neck.,Conocerás la tradición de los anillos de latón y su artesanía textil.,Nota: Es un tema controversial; asegúrate de ir con un guía que respete a la comunidad.,"20.0515, 99.8820",https://dynamic-media-cdn.tripadvisor.com/media/photo-o/2b/10/ec/c8/caption.jpg
th062,Novotel Phuket Kamala Beach,Hotel,Da Igual,Phuket,-,Bajo,-,Resort frente al mar en la tranquila playa de Kamala.,Ubicación privilegiada con acceso directo a la playa. Más relajado que Patong pero cerca de todo.,Importante: Desde aquí al aeropuerto son 40-50 min. El show Carnival Magic queda muy cerca de este hotel.,"7.9555, 98.2872",https://dynamic-media-cdn.tripadvisor.com/media/photo-o/18/3a/d0/47/novotel-phuket-kamala.jpg
th063,Ojo Bangkok,Comida,Mañana,Bangkok,2h,Bajo,990 THB+,Restaurante mexicano en el piso 76 de la torre Mahanakhon.,"El menú de almuerzo es la forma más barata de conocer el edificio. Si gastas más de 1500 THB, te dan acceso al Skywalk gratis.",Las vistas son mejores que las del propio mirador público.,"13.7235, 100.5284",https://dynamic-media-cdn.tripadvisor.com/media/photo-o/28/a4/cc/eb/ojo-main-dining-area.jpg
th064,Old Phuket Town,Visita,Mañana,Phuket,2h,Bajo,Gratis,Casco histórico colonial colorido.,Fachadas estilo sino-portugués. Muy instagrameable.,Domingo hay mercado nocturno (Lard Yai).,"7.8848, 98.3891",https://dynamic-media-cdn.tripadvisor.com/media/photo-o/11/49/f6/e1/img-20171115-104952-largejpg.jpg
th065,One Bangkok,Visita,Da Igual,Bangkok,2-3h,Bajo,Gratis,Nuevo distrito futurista con centros comerciales y parques.,"Arquitectura de vanguardia, áreas verdes y tecnología de punta. Representa la ""Bangkok del futuro"".",Ideal para pasear cuando el calor es extremo gracias a sus áreas abiertas diseñadas con ventilación natural.,"13.7265, 100.5450",https://rwdi.com/wp-content/uploads/2025/06/One-Bangkok-Frasers-Property-Holdings-Thailand.jpg
th066,Pak Khlong Talat,Visita,Noche,Bangkok,1.5h,Bajo,Gratis,El mercado de flores más grande y colorido.,"Funciona 24h, pero el pico de actividad es a las 3:00-4:00 AM. Muy cerca de Wat Pho.",Es un gran lugar para ver la vida local real sin filtros turísticos.,"13.7416, 100.4950",https://dynamic-media-cdn.tripadvisor.com/media/photo-o/01/ea/12/fa/flower-market.jpg
th067,Patong Sneakers,Compras,Noche,Phuket,1.5h,Bajo,490 THB+,"Tienda de zapatillas de segunda mano y ""pre-loved"" de alta calidad.","Tienen modelos de Jordan, Yeezy y Nike a precios muy bajos. Los precios son fijos, no hace falta regatear.",Ideal para renovar calzado si viajas con poco equipaje.,"7.8937, 98.2988",https://media.phuket-plaza.com/images/pre/large/040125-01574.jpg
th068,Phi Phi Islands (Day Trip),Visita,Tarde,Krabi/Phuket,8h,Alto,2500 THB,Maya Bay y lagunas turquesas.,Se llega en lancha rápida. Incluye snorkel y almuerzo.,Maya Bay puede cerrar en temporada baja por restauración.,"7.7407, 98.7784",https://media-cdn.tripadvisor.com/media/attractions-splice-spp-674x446/08/a3/6b/14.jpg
th069,Phra Nang Cave Beach,Playa,Da Igual,Railay,2h,Bajo,Gratis,Playa con altar de fertilidad y cuevas.,Una de las playas más bellas del mundo. Escenario de escalada y aguas turquesas.,Se llega caminando 15 min desde Railay East.,"8.0047, 98.8375",https://dynamic-media-cdn.tripadvisor.com/media/photo-o/0c/fd/37/5b/fb-img-1474058408344.jpg
th070,Phuket Cooking Class (VJ),Gastronomía,Mañana,Phuket,3.5h,Bajo,1800 THB,Clase personalizada con chef local.,Enfoque en mariscos y platos clásicos del sur. Muy interactivo.,La ubicación es cerca de las playas principales.,"7.8320, 98.3315",https://dynamic-media-cdn.tripadvisor.com/media/photo-o/14/1e/99/8f/phuket-thai-cooking-class.jpg
th071,Promthep Cape Sunset Viewpoint,Visita,Tarde,Phuket,1-1.5 hs,Bajo,Gratis,El mirador de atardecer más famoso del sur de Phuket (puede estar muy concurrido).,Llegar 45–60 min antes del sunset para estacionar y encontrar buen lugar. Llevar agua.,"Si querés fotos, subí antes de la hora pico y quedate hasta después del ocaso.","7.7614, 98.3036",https://kamalabeachestate.com/wp-content/uploads/2024/09/Promthep-Cape-10-of-26.jpg
th072,Railay Beach,Playa,Da Igual,Krabi,1 día,Medio,200 THB,Playa aislada rodeada de acantilados gigantes.,Solo accesible en bote (longtail) desde Ao Nang. Famosa por la escalada en roca.,Phra Nang Cave es la mejor playa de este sector (lado oeste).,"8.0119, 98.8367",https://dynamic-media-cdn.tripadvisor.com/media/photo-o/0e/be/e8/6f/railay-beach.jpg
th073,Rajadamnern Muay Thai Stadium (Fight Night),Actividad,Noche,Bangkok,2-3 hs,Bajo,~1.500–3.500 THB,Noche de Muay Thai en uno de los estadios históricos de Bangkok.,Ver calendario y comprar tickets con anticipación. Llegar 30–45 min antes para ubicarse.,"Tomá esto como show cultural; si querés una noche distinta fuera de rooftops, es buena opción.",-,https://dynamic-media-cdn.tripadvisor.com/media/photo-o/2e/d8/f4/17/muay-thai-boxing-tickets.jpg
th074,Retiros en ATM (Cajeros),Consejo,Mañana,Tailandia,5m,Bajo,220 THB,Comisión fija por sacar dinero con tarjetas extranjeras.,"Todos los cajeros tailandeses cobran 220 THB por transacción, sin importar el monto.","Conviene retirar el máximo permitido (normalmente 20,000 o 30,000 THB) para amortizar la comisión.","13.7563, 100.5018",https://www.infoviajera.com/wp-content/uploads/2018/01/Extraer_Efectivo_Baht_Tailandia_Cajero_Automatico_Tarjeta_de_Credito.jpg
th075,Sak Yant Tattoo,Experiencia,Tarde,Bangkok,3-5h,Medio,Variable,Tatuaje tradicional tailandés hecho con varilla.,"Realizado por un maestro Ajarn. No es solo un tatuaje, incluye un ritual de bendición y protección.","Requiere un compromiso ético de ""hacer el bien"" para que la protección funcione.","13.7563, 100.5018",https://cdn.forevervacation.com/uploads/tour/the-sacred-sak-yant-tattoo-tour2.jpg
th076,SAMA Onsen & Massage,Spa,Tarde,Phuket,2h,Bajo,1800 THB+,Fusión de onsen japonés y masaje tailandés.,Experiencia de relajación profunda con piscinas de diferentes temperaturas.,Muy recomendado tras días intensos de excursiones en barco.,"7.8920, 98.3010",https://ik.imagekit.io/tvlk/xpe-asset/AyJ40ZAo1DOyPyKLZ9c3RGQHTP2oT4ZXW+QmPVVkFQiXFSv42UaHGzSmaSzQ8DO5QIbWPZuF+VkYVRk6gh-Vg4ECbfuQRQ4pHjWJ5Rmbtkk=/4144543488781/SAMA-Onsen-Massage-in-Phuket-City-37ca4d47-3fab-436c-b790-a085862a1cad.jpeg
th077,Santhiya Resort (Koh Yao Yai),Alojamiento,Tarde,Koh Yao Yai,-,Bajo,Alto,Resort de lujo de madera tallada a mano frente al mar.,Recomendado por creadores como alternativa a Phuket por ser menos turístico y más tranquilo.,Se llega en barco rápido (speed boat) desde el muelle de Phuket.,"8.0494, 98.6015",https://dynamic-media-cdn.tripadvisor.com/media/photo-o/31/69/b7/e6/santhiya-koh-yao-yai.jpg
th078,Skyflyers Giant Swing,Visita,Mañana,Bangkok,15m,Alto,320 THB,El columpio gigante más alto del mundo en un parque de atracciones.,Ubicado en Asiatique. 135 metros de altura. Adrenalina pura con vistas al río.,Ir al atardecer para fotos épicas desde el columpio.,"13.7042, 100.5034",https://www.pelago.com/img/products/None-None/skyflyers-giant-swing-ride-at-asiatique-bangkok-thailand/48d5f142-cdc9-4e01-ba96-f65c848e182c_skyflyers-giant-swing-ride-at-asiatique-bangkok-thailand-xlarge.webp
th079,So Thai Spa Bangkok,Spa,Da Igual,Bangkok,2h,Bajo,1200 THB+,Spa premium con masajes tradicionales de alta calidad.,Ubicado en Sukhumvit. Ambiente elegante y terapeutas expertos.,Ideal para el primer día tras el vuelo largo (Jet lag).,"13.7330, 100.5620",https://media-cdn.tripadvisor.com/media/attractions-splice-spp-720x480/0b/0e/f4/f5.jpg
th080,Soi Romanee,Visita,Tarde,Phuket Town,1h,Bajo,Gratis,La calle más pintoresca y colorida del casco antiguo.,Edificios de estilo sino-portugués llenos de cafeterías y flores. Muy concurrida para fotos de Instagram.,Ve por la mañana temprano si quieres la calle vacía.,"7.8848, 98.3891",https://media-cdn.tripadvisor.com/media/photo-s/05/30/23/e3/phuket-town.jpg
th081,SokSiam (IconSiam Barco),Transporte,Tarde,Bangkok,15-20m,Bajo,8 THB,Barco lanzadera oficial desde el muelle Sathorn.,No tomes los barcos de 30 o 100 THB; el oficial de IconSiam cuesta solo 8 THB.,El trayecto ofrece vistas rápidas pero lindas del skyline del río.,"13.7274, 100.5103",https://media-cdn.tripadvisor.com/media/attractions-splice-spp-720x480/16/b7/7f/f1.jpg
th082,SookSiam (ICONSIAM),Comida,Noche,Bangkok,2h,Bajo,Variable,Mercado flotante interior con aire acondicionado.,Planta baja del mall. Reúne comida de las 77 provincias de Tailandia.,Precios de calle en un entorno de lujo y limpio.,"13.7274, 100.5103",https://dynamic-media-cdn.tripadvisor.com/media/photo-o/2d/ac/29/3c/sooksiam-iconsiam-g-fl.jpg
th083,Sticky Waterfall (Bua Thong),Visita,Da Igual,Chiang Mai,3h,Alto,Gratis,Cascada de piedra caliza que se puede trepar.,"El depósito de calcio hace que las rocas no resbalen, permitiendo subir a pie como ""Spider-man"".",Lleva ropa que se pueda mojar y toalla; hay vestuarios en el lugar.,"19.0718, 99.1089",https://dynamic-media-cdn.tripadvisor.com/media/photo-o/11/e2/f5/56/beautiful-relatively.jpg
th084,Sukhothai Historical Park,Visita,Tarde,Sukhothai,4h,Medio,100 THB,Ruinas de la primera capital del Reino de Siam.,Patrimonio UNESCO. Mucho más tranquilo y menos masificado que Ayutthaya.,Tip IA: Alquila una bicicleta en la entrada (30 THB) para recorrer los tres sectores.,"17.0185, 99.7036",https://dynamic-media-cdn.tripadvisor.com/media/photo-o/32/4d/ce/6e/caption.jpg
th085,Sunday Walking Street,Mercado,Da Igual,Chiang Mai,3h,Medio,Gratis,El mercado más grande y auténtico del país.,Solo domingos. Ocupa toda la calle Ratchadamnoen. Artesanías y comida increíble.,Empieza a las 17:00h. Se llena mucho; ve temprano.,"18.7877, 98.9895",https://dynamic-media-cdn.tripadvisor.com/media/photo-o/07/fb/d2/70/saturday-night-market.jpg
th086,SuperRich (Verde),Consejo,Tarde,Bangkok,10m,Bajo,-,La mejor casa de cambio de divisas de la ciudad.,El color verde suele tener una tasa ligeramente mejor que el naranja. Hay muchas sucursales en centros comerciales.,Necesitas el pasaporte físico para cualquier operación de cambio.,"13.7485, 100.5404",https://tuguiaentailandia.com/wp-content/uploads/2023/11/Super-Rich-Thailand-verde-cambio-moneda-en-bangkok.png
th087,Taxi Público Aeropuerto (Suvarnabhumi),Transporte,Da Igual,Bangkok,45-60m,Bajo,600 THB,Servicio de taxis oficiales controlados por sistema de tickets.,"No aceptes ofertas de taxistas en la puerta. Debes ir a las máquinas, sacar un ticket con el número de carril (ej. carril 44) y dirigirte allí. El costo incluye: taxímetro + 50 THB tasa aeropuerto + peajes.",Un taxi oficial puede costar hasta un 50% más que pedirlo por la App Grab (ej. 600 THB vs 400 THB).,"13.6899, 100.7501",https://eaqxr36k8gu.exactdn.com/wp-content/uploads/2023/01/como-llegar-bangkok-desde-suvarnabhumi-taxi.jpg
th124,Tha Kha Floating Market,Mercado,Mañana,Bangkok (excursión),4-6h (con traslados),Medio,Variable,Mercado flotante más local y tranquilo (alternativa).,Más chico/auténtico. Chequear día/horario (suele moverse por finde). Ideal para quienes quieren evitar el turismo masivo.,Fuente: video (reels). Coords web.,"13.54815, 99.93604",https://dynamic-media-cdn.tripadvisor.com/media/photo-o/30/4e/29/e1/caption.jpg
th128,The Secret Brunch (Koh Samui – Lamai),Comida,Mañana-tarde,Koh Samui (Lamai),1-1.5h,Bajo,Medio,Brunch/café con opciones vegetarianas/vegan (zona Lamai).,Cerca de Makro Lamai. Buen café + brunch. Ideal para mañana tranquila.,Fuente: video (reels). Dirección en Lamai; faltan coords exactas en esta pasada.,-,https://dynamic-media-cdn.tripadvisor.com/media/photo-o/1c/dc/30/d1/healthy-can-be-delicious.jpg
th126,The Verandah Cafe (Ao Nang),Comida,Mañana-tarde,Krabi (Ao Nang),1-1.5h,Bajo,Variable,Café/brunch popular en Ao Nang.,Ideal para desayuno/brunch antes de tours. Buena opción “occidental” + café. Puede haber espera en temporada alta.,Fuente: video (reels). Coords web.,"8.036787, 98.81916",https://dynamic-media-cdn.tripadvisor.com/media/photo-o/30/4d/04/86/caption.jpg
th088,Tichuca Rooftop Bar,Visita,Mañana,Bangkok,2h,Bajo,500+ THB,"Bar en las alturas con un ""árbol"" de luces LED gigante.",Ubicado en el edificio T-One. Famoso en TikTok por sus medusas de luz. Se requiere vestimenta casual-elegante.,Suele haber mucha fila; intenta ir justo cuando abren (17:00h).,"13.7230, 100.5794",https://dynamic-media-cdn.tripadvisor.com/media/photo-o/2a/0d/96/be/tichuca-rooftop-bar.jpg
th129,Tiger Park Phuket,Experiencia,Mañana/Tarde,Phuket,2-3h,Bajo,900–1.300 THB (según tamaño/paquete),Parque para fotos/interacción con tigres (actividad polémica).,"Ubicación: 82/2 Moo 10 Soi Yot Sane 1, Chalong, Phuket 83130. Horario aprox.: 09:00–18:00. Experiencia típica: interacción/fotos (15 min) con tigres por tamaño (restricciones de edad/altura según tamaño). Tip: ir temprano para menos filas; leer reglas de seguridad y evitar flash. Transporte: taxi/Grab desde Patong/Kata/Karon ~30–60 min (según tráfico).",Turismo con fauna silvestre en cautiverio suele tener riesgos de bienestar animal. Si decidís ir priorizá lugares con prácticas transparentes y manejo profesional; considerá alternativas sin contacto.,"7.8319351, 98.3242214",https://dynamic-media-cdn.tripadvisor.com/media/photo-o/1b/11/31/ac/img-2531-largejpg.jpg
th089,Tren a Ayutthaya,Consejo,Tarde,Transporte,1.5h,Bajo,15 THB,El viaje más barato de Bangkok a las ruinas antiguas.,Salida desde estación Hua Lamphong o Krung Thep Aphiwat. El tren local es una experiencia muy auténtica.,En Ayutthaya alquila una bici o tuk-tuk para ver los templos.,"14.3472, 100.5847",https://media.tacdn.com/media/attractions-splice-spp-674x446/09/1e/4f/9c.jpg
th090,Tren Nocturno (Nº 9),Transporte,Mañana,BKK-Chiang Mai,13h,Bajo,~1000 THB,El mejor tren nocturno para ir al norte del país.,"El tren número 9 es el más moderno. Incluye cama, sábanas limpias y cena. El aire acondicionado es muy fuerte.",Tip Crucial: Reserva la cama de abajo; es más ancha y tiene ventana. Lleva abrigo.,"13.8043, 100.5402",https://wanderlustmemories.com/wp-content/uploads/2017/02/tren_chiang_mai_alex.jpg
th091,Vieng Thapae Resort,Hotel,Da Igual,Chiang Mai,-,Bajo,-,Resort estilo colonial Lanna cerca de la muralla.,Ubicado a pasos de la Tha Phae Gate. Ideal para recorrer el casco antiguo a pie y cerca del mercado de los domingos.,"Al estar tan céntrico, puedes volver a descansar un rato al mediodía para evitar el pico de calor.","18.7875, 98.9935",https://dynamic-media-cdn.tripadvisor.com/media/photo-o/1b/c3/cd/4f/viang-thapae-resort.jpg
th092,Vuelo BKK - CNX,Vuelo,Da Igual,Bangkok,1h 20m,Bajo,-,Vuelo local a Chiang Mai.,Salida 24/02 08:50. Air Asia FD4100.,Traslado al hotel en CNX estimado en 40-60 min por tráfico. Valida el peso de cabina; Air Asia es estricto con los 7kg.,"13.6899, 100.7501",https://cdn.istanbultouristpass.com/banner/doc/istanbul%20layover%20what%20to%20do%20in%205%20hours%20(2).jpg
th093,Vuelo BKK - IST,Vuelo,Da Igual,Bangkok,10h 20m,Medio,-,Inicio del regreso a casa.,Salida 09/03 23:45. Thai Airways TG900.,Estrategia: Deja maletas en Hotel Column y ve al aeropuerto a las 20:30.,"13.6899, 100.7501",https://cdn.istanbultouristpass.com/banner/doc/istanbul%20layover%20what%20to%20do%20in%205%20hours%20(2).jpg
th094,Vuelo CNX - HKT,Vuelo,Da Igual,Chiang Mai,2h 10m,Bajo,-,Vuelo directo al paraíso (Phuket).,Salida 28/02 11:40. Air Asia FD8165.,"Ojo: El traslado a Kamala/Patong es de 45-60 min, no 10 min [Recomendación IA].","18.7753, 98.9675",https://cdn.istanbultouristpass.com/banner/doc/istanbul%20layover%20what%20to%20do%20in%205%20hours%20(2).jpg
th095,Vuelo EZE - GRU,Vuelo,Da Igual,Buenos Aires,2h 35m,Bajo,-,Inicio del viaje: Tramo Buenos Aires a San Pablo.,Salida 16/02 23:55. Turkish TK15.,Escala técnica corta de 1h 40m. No suele requerir bajar del avión.,"-34.8150, -58.5348",https://cdn.istanbultouristpass.com/banner/doc/istanbul%20layover%20what%20to%20do%20in%205%20hours%20(2).jpg
th096,Vuelo GRU - EZE,Vuelo,Da Igual,San Pablo,3h 05m,Bajo,-,Último tramo a casa.,Salida 10/03 19:20. Llegada a EZE 22:25.,Escala técnica de 1h 35m en San Pablo.,"-23.4356, -46.4731",https://cdn.istanbultouristpass.com/banner/doc/istanbul%20layover%20what%20to%20do%20in%205%20hours%20(2).jpg
th097,Vuelo GRU - IST,Vuelo,Da Igual,San Pablo,12h 25m,Medio,-,Tramo largo hacia Estambul.,Salida 17/02 04:10. Llegada a IST a las 22:35.,Prepárate para una escala larga de 16h 55m en Estambul.,"-23.4356, -46.4731",https://cdn.istanbultouristpass.com/banner/doc/istanbul%20layover%20what%20to%20do%20in%205%20hours%20(2).jpg
th098,Vuelo HKT - BKK,Vuelo,Da Igual,Phuket,1h 35m,Bajo,-,Regreso a la capital para el cierre.,Salida 07/03 10:00. Air Asia FD4125.,Traslado al hotel Column BKK estimado en 35-50 min.,"8.1132, 98.3076",https://cdn.istanbultouristpass.com/banner/doc/istanbul%20layover%20what%20to%20do%20in%205%20hours%20(2).jpg
th099,Vuelo IST - BKK,Vuelo,Da Igual,Estambul,8h 50m,Medio,-,Tramo final Estambul a Bangkok.,Salida 18/02 15:30. Llegada a BKK el 19/02 04:20 AM.,"Llegarás temprano a Bangkok; coordina con el hotel el ""Early Check-in"".","13.6899, 100.7501",https://cdn.istanbultouristpass.com/banner/doc/istanbul%20layover%20what%20to%20do%20in%205%20hours%20(2).jpg
th100,Vuelo IST - GRU,Vuelo,Da Igual,Estambul,13h 45m,Alto,-,Tramo largo de regreso.,Salida 10/03 10:00. Turkish TK15. Escala en IST de 3h 55m.,Pide en BKK que etiqueten el equipaje hasta Buenos Aires (EZE).,"41.2752, 28.7519",https://cdn.istanbultouristpass.com/banner/doc/istanbul%20layover%20what%20to%20do%20in%205%20hours%20(2).jpg
th101,Vuelo TG900 (Thai),Vuelo,Mañana,BKK-IST,10h 20m,Bajo,-,Vuelo de regreso Bangkok a Estambul.,Salida 09/03/2026 a las 23:45 hs.,Pide en el counter que etiqueten tu maleta hasta EZE (Buenos Aires).,"13.6899, 100.7501",https://cdn.istanbultouristpass.com/banner/doc/istanbul%20layover%20what%20to%20do%20in%205%20hours%20(2).jpg
th102,Wat Arun,Visita,Tarde,Bangkok,1h,Medio,200 THB,"El Templo del Amanecer, icónico por su torre central decorada con porcelana.",Cruza el río desde Wat Pho en el ferry público (5 THB). La subida a las torres es empinada. Atardecer increíble desde la orilla opuesta.,De noche se ilumina y es una de las fotos más famosas de Bangkok.,"13.7437, 100.4889",https://media.tacdn.com/media/attractions-splice-spp-674x446/0e/e4/99/ab.jpg
th103,Wat Chaiwatthanaram,Visita,Da Igual,Ayutthaya,1.5h,Bajo,50 THB,Templo de estilo Khmer junto al río.,El más fotogénico de Ayutthaya. La luz del atardecer es espectacular sobre sus ruinas.,No se permite subir a las torres centrales por preservación.,"14.3435, 100.5418",https://dynamic-media-cdn.tripadvisor.com/media/photo-o/01/09/4d/59/farview-of-wat-chaiwatthanaram.jpg
th104,Wat Chalong (Wat Chaiyathararam),Visita,Mañana/Tarde,Phuket,1-1.5 hs,Bajo,Gratis,Templo más importante de Phuket: arquitectura y detalles interiores muy fotogénicos.,Ir fuera de horas pico. Vestimenta respetuosa. Suele estar abierto aprox. 08:00–17:00.,Buen complemento si hacés tour por el sur (Big Buddha/Promthep).,"7.846389, 98.336944",https://dynamic-media-cdn.tripadvisor.com/media/photo-o/1a/0b/77/c9/chaithararam-temple-wat.jpg
th105,Wat Chedi Luang,Visita,Mañana/Tarde,Chiang Mai,1-1.5 hs,ºº,50 THB,"Templo clave del casco antiguo de Chiang Mai, con gran chedi histórico.",Conviene temprano. Combina bien con paseo por el Old City y cafés cercanos.,"Si vas un domingo, mirá si coincide con mercados/eventos alrededor del Old City.",-,https://dynamic-media-cdn.tripadvisor.com/media/photo-o/12/f3/be/75/restored-ruin-of-the.jpg
th106,Wat Mahathat,Visita,Da Igual,Ayutthaya,1h,Bajo,50 THB,Famoso por la cabeza de Buda entre raíces.,El punto más icónico. Hay que agacharse para la foto (tu cabeza no puede estar más alta que la de Buda).,Ir muy temprano para evitar las hordas de buses de tour.,"14.3570, 100.5675",https://dynamic-media-cdn.tripadvisor.com/media/photo-o/0c/34/cc/17/a-mountain-range-of-pagodas.jpg
th107,Wat Paknam MRT,Transporte,Noche,Bangkok,30m,Bajo,30 THB,Cómo llegar al Gran Buda de forma fácil y barata.,Toma el metro (MRT Blue Line) hasta la estación Bang Phai. Camina 10 min o toma un mototaxi por 20 bahts.,Es la mejor opción para evitar los barcos caros.,"13.7206, 100.4727",https://media-cdn.tripadvisor.com/media/attractions-splice-spp-674x446/13/e0/bf/8e.jpg
