id,Nombre,Tipo,Horario,Ciudad,Tiempo,Esfuerzo,Costo,Descripción,Detalle,NotaIA,LATLON,Image
th108,Wat Pha Lat (Hidden Temple),Visita,Mañana/Tarde,Chiang Mai,1.5-2.5 hs,Medio,Gratis,"Templo escondido en la selva en la ladera de Doi Suthep, accesible por caminata (Monks Trail) o taxi.",Si lo hacés caminando: zapatillas + agua. Puede haber tramos resbaladizos si llovió.,"Es un ‘templo sorpresa’: menos turismo, más naturaleza. Ideal si ya fuiste a Doi Suthep.","18.799137, 98.933975",https://dynamic-media-cdn.tripadvisor.com/media/photo-o/27/41/d9/0d/temple.jpg
th109,Wat Pho,Visita,Mañana,Bangkok,1.5h,Bajo,300 THB,Templo del Buda Reclinado más grande de Tailandia (46m).,Famoso por sus pies de nácar y por ser la cuna del masaje tradicional. Está a pasos del Gran Palacio.,"Si tienes tiempo, hazte un masaje aquí; es la escuela oficial del país.","13.7465, 100.4933",https://dynamic-media-cdn.tripadvisor.com/media/photo-o/16/6a/2a/21/po-prostu-piekna-swiatynia.jpg
th110,Wat Phra Singh,Visita,Mañana/Tarde,Chiang Mai,1-1.5 hs,Bajo,20 THB,"Uno de los templos más importantes de Chiang Mai, famoso por su sala principal y detalles Lanna.",Ideal en circuito Old City. Vestimenta respetuosa (hombros/rodillas).,"Si te gustan templos “bien cuidados”, este suele impresionar.","18.788750, 98.9812139",https://dynamic-media-cdn.tripadvisor.com/media/photo-o/15/b3/9e/8b/c360-2018-12-09-16-47.jpg
th111,Wat Phra That Doi Suthep,Visita,Mañana,Chiang Mai,3h,Medio,30 THB,Templo sagrado en la montaña.,306 escalones o funicular. Vista 360 de la ciudad.,Ir al atardecer para ver la ciudad iluminada.,"18.8050, 98.9215",https://media.tacdn.com/media/attractions-splice-spp-674x446/06/96/8d/41.jpg
th112,Wat Rong Khun (Blanco),Visita,Mañana,Chiang Rai,1.5h,Bajo,200 THB,Obra de arte moderna en forma de templo.,"Blanco puro con espejos. Símbolo de Chiang Rai. Representa el ciclo de la vida y la muerte. No es un templo antiguo, sino una obra del artista Chalermchai.",Está a 3h de Chiang Mai; se suele hacer como excursión de día. Prohibido fotos dentro del edificio principal.,"19.8242, 99.7630",https://i2.wp.com/tuguiaentailandia.com/wp-content/uploads/2024/08/Entrada-del-El-Templo-Blanco-Wat-Rong-Khun-de-Chiang-Rai-1024x768.jpeg
th113,Wat Rong Suea Ten (Azul),Visita,Da Igual,Chiang Rai,1h,Bajo,Gratis,Templo moderno con un azul eléctrico vibrante.,Obra del discípulo del creador del Templo Blanco. El Buda blanco interior es impresionante.,"Al ser gratis y visual, se llena rápido; ve temprano.","19.9231, 99.8415",https://phantom-elmundo.unidadeditorial.es/28878ba9269ccf8f99efddb759a7be68/resize/640/assets/multimedia/imagenes/2019/12/30/15777034301650.jpg
th114,Wat Saket (Golden Mount),Visita,Mañana,Bangkok,1.5h,Medio,100 THB,Templo en una colina con vista 360° de la ciudad vieja.,Debes subir 300 escalones suaves rodeados de fuentes y vegetación. Arriba hay una estupa dorada icónica.,Ideal para ir justo antes del atardecer para ver caer el sol sobre Bangkok.,"13.7538, 100.5066",https://i0.wp.com/tuguiaentailandia.com/wp-content/uploads/2023/01/el-templo-wat-saket-bangkok-1024x678.png
th115,Wat Samphran (Dragón),Visita,Da Igual,Nakhon Pathom,2h,Medio,Gratis / 2€ (Dona),Torre de 17 pisos con un dragón gigante que la rodea.,Puedes caminar por el interior del túnel que es el cuerpo del dragón para llegar a la cima. Es un templo menos turístico y muy visual para fotos.,Está a 1 hora de Bangkok; combina bien con el mercado de Maeklong.,"13.7348, 100.2173",https://cdn-67ebd632c1ac1810207eacb0.closte.com/wp-content/uploads/2017/02/Wat-samphran1.jpg
th116,Wat Traimit (Buda de Oro),Visita,Da Igual,Bangkok,1h,Bajo,100 THB,Estatua de oro macizo más grande del mundo.,Pesa 5.5 toneladas. Es la puerta de entrada ideal para caminar luego hacia Chinatown.,Vestimenta respetuosa requerida.,"13.7377, 100.5134",https://dynamic-media-cdn.tripadvisor.com/media/photo-o/1a/56/84/2e/caption.jpg
th117,Yaowarat (Chinatown),Comida,Noche,Bangkok,2h,Medio,Variable,El corazón gastronómico callejero de Bangkok.,Ir de noche para ver los neones y comer en los puestos callejeros. Muy concurrido y caótico.,No te pierdas los bollos de crema (Bun) y la sopa de noodles de pimienta.,"13.7412, 100.5081",https://thumbs.dreamstime.com/b/noche-en-el-camino-de-yaowarat-es-una-calle-principal-chinatown-bangkok-la-comida-famosa-tailandia-muchos-turistas-est%C3%A1n-149086336.jpg
th118,Zoe in Yellow,Vida Nocturna,Noche,Chiang Mai,3h,Bajo,Variable,El bar más famoso del casco antiguo.,Punto de encuentro de viajeros. Música variada y mucha gente joven.,Cierra relativamente temprano (00:00 - 01:00) por normativas locales.,"18.7905, 98.9902",https://dynamic-media-cdn.tripadvisor.com/media/photo-o/13/a3/80/0a/songkran2018.jpg
th119,Estambul Lounge,Sugerencia,22:35–07:30,Estambul (IST),8–9h,Bajo,Variable,"Para hacer Touristanbul tenés que salir de airside: pasar migraciones y presentarte en el 'Hotel Desk' (zona de llegadas/landsid e). Alternativas para descansar: IGA Lounge (airside), Sleepod (airside) o Plaza Premium (landside).","Plan recomendado: 22:35 llegar y quedarte en airside (IGA Lounge si tenés Priority Pass/DragonPass o pagás en puerta; Nap Zone + duchas + buffet 24h). 06:00–06:30 salir de la lounge, ir a migraciones y presentarte en Hotel Desk antes de 07:30. Alternativa: IGA Sleepod (cápsulas por hora, más privado pero sin comida/duchas). Si pagás lounge, evaluar YOTEL Airside (a veces precio similar por cama real).",Reglas de acceso y precios varían por temporada/estatus. Confirmar en sitio oficial (Touristanbul + lounges) el día previo.,"41.275278,28.751944",https://dynamic-media-cdn.tripadvisor.com/media/photo-o/23/42/ec/51/turkish-airlines-business.jpg
th120,Estambul Tour,Experiencia,08:00–11:30,Estambul (IST),3.5h,Bajo,Gratis (si aplica por conexión),Tour panorámico para conexiones con vuelo al mediodía/tarde. Punto de encuentro: Hotel Desk (llegadas) a las 07:30.,"Itinerario típico: salida en bus, vistas Murallas de Constantinopla, Eminönü + Puente de Gálata, parada fotos Cuerno de Oro, vistas Torre de Gálata y Palacio Dolmabahçe, regreso al aeropuerto ~11:30. Tips: llevar abrigo liviano, agua; calculá margen para security al volver.","Confirmar elegibilidad (conexión, horarios, cupos) y día de operación del tour en Touristanbul. Llegar temprano al Hotel Desk.","41.275278,28.751944",https://media.tacdn.com/media/attractions-splice-spp-674x446/16/05/d2/a7.jpg